_id	_class	commentsCount	score	selftext	subreddit	time	user
I think I am finally broken by loneliness, its getting too much to bear for any longer.	com.example.redditnegative.model.RedditPost	3	5	"tw: suicide

I am a 22-year-old straight guy. I have been in a single relationship for 2 years that was manipulative, emotionally abusive, &gt;!and made me almost commit suicide!&lt;. It ended a few years ago, and thankfully I didn't and I am still here. However, my mental health has never really fully recovered, and although I try to hide it, inside I am in so, so much pain. 

I have no siblings. My family lives hours away, and I have maybe 1 good friend that I struggle to stay in frequent contact with. All my other friends have either not bothered to stay in contact, or I have lost through other means.

Essentially, besides my parents, I have no one to talk to in person with. I don't want to open up to people because I know they cant help, and I don't want to burden them with my problems. I also feel like a worthless piece of shit because I'm told by society that as a guy you shouldn't be struggling, and showing that makes you weak, so I just bottle everything up and go on with my day.

But I cannot bottle it up anymore, I have no more space for it, and I am at breaking point. Despite the fact I am in therapy and medicated for my ADHD, I cannot shake the feeling of being so incredibly fucking lonely, and it hurts me more than any abusive relationship could.

I have tried to date online as I am chronically shy, and the thought of going somewhere and having to introduce myself to a girl I like scares me out of a crippling fear of rejection. Of course, as an average-looking dude with no friends and uninteresting life, I stand no chance of finding anyone. Out of the maybe 10 or so matches I have had over the 3 years, all of them will either match with me and I hear nothing or we talk for a bit and then they ghost me, never to be seen again.

I'm tired of feeling worthless.

I'm tired of feeling like I will live my life alone, and die with no one around me.

I'm tired of feeling like I am the problem.

I'm tired of feeling like nothing I ever do matters, so what's the point?

I'm tired of feeling like everything I try is fruitless.

I'm tired of feeling like I will never be able to enjoy life if I am alone.

I'm tired of feeling like no one will ever love me.

I'm tired of feeling like a burden to everyone around me.

I'm tired of being rejected by everyone I meet.

I'm tired of being the only one who has to put everything I have into maintaining a relationship with someone I know doesn't care.

I'm tired of feeling tired.

Most of all, I'm tired of feeling lonely.

Maybe this is just how it's meant to be? 

**Maybe I should just be alone.**"	offmychest	2022-07-02T11:18:24.000Z	throwaway0323425123
Can’t stand my roommate	com.example.redditnegative.model.RedditPost	0	1	"Not a desperately deep issue but needed to let this out somewhere. I’m leaving a list of things that irk me about him here. Thanks Reddit for humoring me

- Never clears mess
-Never takes out trash
- Never pays rent when I ask
- Denies he does anything wrong 
- I’ve talked to him and explained that what he does affects me and my other roommates but doesn’t listen 

My other roommates tell me to leave it as he won’t listen, but it’s unfair to me that he can get away with things just because it’s easier to do so. 

Luckily it’s the end of semester and I won’t live with him again but it still bugs me"	offmychest	2022-07-02T11:16:16.000Z	blue_boXXX
someone stole my plants last night	com.example.redditnegative.model.RedditPost	7	14	"i live in an apartment, i have a few plants, tables, and a chair outside my door. 
i realize any of it could be stolen. i imagined it would be the chair and tables, you know, useful things.

after an entire year, someone stole 3 of my favorite plants, including one that i got during a horrible breakup and absolutely thrived as i healed. 

there’s cameras, but the staff is useless and off on weekends. i live in a city where the police will only come out if someone is dead. not like any of this would recover my plants, anyway.

that’s all. i feel like a moron being so upset over this but i needed to share. don’t steal plants…you never know what they mean to people."	offmychest	2022-07-02T11:12:00.000Z	gldnrtrvrlvr
I really thought you will send me a message today	com.example.redditnegative.model.RedditPost	3	5	Fuck you, and I hope you will be miserable on your birthday too.	offmychest	2022-07-02T10:48:32.000Z	OnceInFourYearsPost
My mother won’t stop being sexual around me.	com.example.redditnegative.model.RedditPost	8	7	"I’m a minor. My mom and dad got divorced 2-3 years ago and my mom found out she was a lesbian. Ever since, it’s been downhill. With one of her girlfriends, I could always hear them having sex in her room. Whenever I broke down and told her it made me super uncomfortable, she seemed annoyed and said that she had to deal with stuff like that when she was younger too. Now she makes it a point to bring up that she had sex. Whenever she has a “lady friend” over, the morning after (if they had sex) she asks me, “could you hear us last night?” and acts all annoyed. When I tell her no, she says that it’s good and they were trying to be quiet.
It’s random too. I’ve been relaxing in her bed recently because my bed has an ant infestation and they keep biting me. She has a vibrator in between her headrest and her mattress. She doesn’t even try to hide it, just keeps it plugged in so if I accidentally followed the wrong wire I would find it. She knows I chill in her bed too, and she hasn’t moved it. Once, as a joke, when she came to make me leave her bed so she could go to bed, I told her “I farted in your bed”, because I did, and I wanted her to laugh. She just looked at me and went “okay, well I had sex in my bed last night,” and I felt so disgusted. She keeps walking around naked even when we have the back door open and when I tell her to stop, she says that people should be thankful they get to see a “hot blonde lady”. It’s so uncomfortable. Everyone says the puberty talk is embarrassing, but the “asking your mom to stop being sexual all the time” talk is going to be 10x more embarrassing."	offmychest	2022-07-02T10:44:16.000Z	IceIsTrash
advice please	com.example.redditnegative.model.RedditPost	2	2	So I'm 27 male my life has always been a constant mental struggle. My parents although they mean well they believe they are helping but are doing the exact opposite. The constant pointing out flaws of mine. The constant belittling, always making me feel like I'm worthless, can't do anything right all the time. If they help me in any way it's held over my head. It's always been a constant fight. I've tried talking to them and they do not listen. And I'm running out of ideas to try and out of fight to the point of the subtle thought of suicide that were few and far between are now a constant and looking like the only way out. I've tried talking to professionals and all they want to do is give pills rather then deal with the issue. Any suggestions would a great help	offmychest	2022-07-02T10:42:08.000Z	FarmBoy4840
I dated a sociopath and it was pretty intense. She has a body count.	com.example.redditnegative.model.RedditPost	0	1	"I don’t want to stigmatize mental illness. A person with antisocial personality disorder is a person. It was such a crazy experience. She was constantly testing my reality. Gaslighting me, turning people against me for fun. Making people hate me because she was bored. My dog got poisoned and it cost me like $5000 to keep him alive. I cared about her because I saw her as a victim of a mass shooting but now I’m starting to think she instigated that shooting and didn’t realize it would get out of hand. I think that really put her over the edge. 

I just had to get that off my chest. I don’t know how to feel. I don’t know to feel compassion or hate. Her family knows she’s kind of psychopathic. Even if you’re a girl that is kind of psychopathic and toying with a person and they go on a shooting rampage and kill people I don’t know if it’s your fault. Maybe you thought you were just playing around. 

I’d like some help making sense of it. I don’t expect much from Reddit. I’m just pouring my heart out. I’m not trying to be any sort of way. Thanks for your input.

I have struggled with mental health issues for a long time and after being put through the wringer by her and the flying monkeys I actually feel like she did me a favor. She taught me things about myself that I wasn’t able to learn before. She was brutal and highly selfish but I learned. I definitely learned some stuff I’d been needing to learn tor a long time."	offmychest	2022-07-02T10:40:00.000Z	smokepedal
I’m a failed human	com.example.redditnegative.model.RedditPost	6	11	"As in, my parents gave it a go, and produced someone by chance who is just a drag on society rather than an asset. Everything about my life and myself is just wrong, not designed to succeed. And it’s all chance. 

I have no desire to go outside, I have horrible health which makes it hard to even go outside, have a horrible body where some things can’t even be fixed, can’t have sex, no dog eat dog ambition, I’m trapped in this cycle and have no fight to fix. I just want to die and say to my parents ‘you tried, but this human didn’t work out.’"	offmychest	2022-07-02T10:35:44.000Z	tiptoeandson
Slowly, Accidentally Left a Minor Road Accident	com.example.redditnegative.model.RedditPost	1	1	"Using a throwaway. This morning, I was driving and clipped a lorry parked on the side of the road (the guy was switching out a banner on a lamppost). I stopped a few meters in front of the lorry for a few minutes out of shock. I was probably there for a few minutes, and nobody came over.  


I put on the turn signal and slowly turned into the next turning, parked my car and got down. Other than a broken side mirror, my car was fine. I started walking to the lorry, but by the time I got there, the lorry had already driven off. I circled the area a few times but I couldn't find the lorry.

I didn't get the license plate down, and the driver was already gone. I would've offered to pay for any damages (as it was 100%) my fault, but I can't find the guy. What do I do?"	offmychest	2022-07-02T10:35:44.000Z	HelpWithCarProblems
Unapproved vasectomy	com.example.redditnegative.model.RedditPost	2	1	"During the age of 14 I was camping with my family and cut my balls open while sliding down a tent pole that had a sharp object protruding out of it.
I immediately went to the hospital and had it stitched it up. I was under anesthesia.
Lately iv been hearing horror stories (real ones) of doctors doing sick things to patients.
Might be a pretty crazy fear, but i just had to get it off my chest.
I’ll probably go see a doctor for a sperm count soon."	offmychest	2022-07-02T10:12:16.000Z	LateMansion
I feel so frustrated by my friend who has self-diagnosed ADD, and I feel bad about it but also can’t help myself	com.example.redditnegative.model.RedditPost	0	1	"My best friend and I started this project together where we made a little poetry book with poems and art that people sent us during an open call. We’re at our second edition, all the volunteers did their part of the work apart from my friend. But we had an agreement with an event in our city where we said we’d be selling the books, and they posted the announcement of us being there so my friend crunched everything in one night and did everything last minute so that I have time to print it as well before the event. If it wasn’t for this even I’m pretty sure she would have never finished.

I didn’t even check it throughout before printing because we had such little time left.

Now the book is out and 3 people have already written to us saying their names were spelled wrong or their name was put next to art that wasn’t theirs - and I can’t help myself but be so fucking frustrated, because I also come out looking like an unattentive and careless editor. I trusted her to do her part and she didn’t see it through to the end.

She says she has ADD (undiagnosed by a doctor) so I can’t say anything. But I’m soooo frustrated rn with her and idk what to do."	offmychest	2022-07-02T09:29:36.000Z	miraculousmammal
My friend used my past against me.	com.example.redditnegative.model.RedditPost	7	1	For context my (20f) friend (19f) both had very hard past few years. We both sufferd from depression and it was hard to stay friends. There was a lot of ups and downs. In that time I had one boyfriend who was really mean and a total ah but I didn’t realize how bad it actually was until I got out of the relata year later. Then again last year I was going out with a guy who was very very manipulative and really used me until I was nearly broken. During this time I tried to stay as supportive of her as I could even though she did do some hurtful things to me. Well we both are doing better now. I’m still struggling but it is better and we went out yesterday. She told me she like this guy called Dave. I’ve met dave before and he is troubble. He is mean and very egotistical. She said she knows this but she still wants to maby date him. I told her she deserves better then him and that there is a good guy out there somewhere. She said there is no good relationship and I deisgreed so she said what about your relationships. It hurt me a lot because the guys I was with were so mean and I really struggled for a long time because of it. Its not like I knew they were bad news at the start they were nice but once they got a hold of me they took advantage of me. Its not the first time she has used such things against me but I forgave her because she was in a bad place. She also called me desperate which is defenetly not the case. I just said I was ready to maby meet someone again.	offmychest	2022-07-02T09:23:12.000Z	taaffeites
I hate when my sister borrows my clothes	com.example.redditnegative.model.RedditPost	1	3	This sounds so awful but I absolutely despise when my older sister borrows my clothes. She’s a size XL and I’m a size XS so she usually takes clothes that are a big baggy on me or loose and stretches the out which makes them look too big on me or tears the fabric a bit. It bothers me because I’ve lost a lot of my comfortable clothes because of it, I know it’s so silly but I don’t want to wear form fitting shirts all the time especially since I bloat easily and it makes me anxious to wear tight clothes. This is so dramatic but I’m so upset because I feel like nothing I own can be mine unless no one else can use it. Whenever I try to bring up the issue she just tells me “you take my clothes” (I ask her before mind you) and if I bring up the weight issue she gets angry and upset and starts crying. My mom is telling me to be the bigger person and let it go but we don’t have money to buy new clothes. What the fuck do I do she stretched out my senior shirt!!	offmychest	2022-07-02T09:21:04.000Z	Weary_Alfalfa_3406
I’m being touched at my work place	com.example.redditnegative.model.RedditPost	32	48	Ok so I am a 14 M and I work at dominos and a Indian guy (let’s call him tommy) has been touching me such as grabbing my cheeks and pinching my stomach and today he tried to go down low and grab my Dick so I took his hand and redirected it to the sink. I don’t want to tell the manager because she is dating tommy. I rely on income to buy me stuff when I go out with friends. He’s a weird guy and I want to know what to do he gave me his Snapchat for some reason and when I didn’t add him he got mad at me. Please Help.	offmychest	2022-07-02T09:18:56.000Z	CheckItchy
Any American That Isn't Physically Protesting In The Streets Is Just As Responsible for What Is Happening To Your Country.	com.example.redditnegative.model.RedditPost	1	0	The only thing necessary for the triumph of evil is for good men to do nothing	offmychest	2022-07-02T09:10:24.000Z	Historical_Goose6208
I Think My Mom Is Going Crazy	com.example.redditnegative.model.RedditPost	2	3	"She asked me not to talk about this, but I think I have to, because I don’t know what else to do.

Everything started around a month ago, I had come back home from a night at my aunt’s house. My mom was excited and she immediately sat me down at the table, my sister was rolling her eyes and she looked annoyed about the entire thing. My mom had told me she’d had a spiritual awakening, and that she thought she had died. She said she felt spiritual, as thought she was an angel brought to help “wake people up”. I’ve never been overly religious, but I’m pretty open minded, so I said okay, asked her some questions and dropped it. 

Then, around two weeks after that night, she came home in a horrible mood. She screamed, and threw things, and stomped. It was horrifying but no one reacted. We left her alone and let her throw a tantrum and let it pass. I came downstairs to eat at around 12 AM, and she came down, and it was like she was in a trance. After breaking shit just a few hours earlier she was completely calm, sitting down at the table, watching a priest talk and humming. It genuinely gave me chills. 

Then, it all went to shit yesterday. I thought the spiritual stuff was over, she stopped talking about it and I stopped thinking about it. I woke up at around 3 PM, I went downstairs, greeted my mom and was about to start talking to her about some news that had happened the previous day. She sat me down, and told me she made a major breakthrough. She told me we were all zombies, that our brains were poisoning us, that oxygen is poisoning us, food, sleep. I knew that what she was saying was insane, but for some reason I didn’t feel she was insane. She said we were all zombies in a trance, that we needed to “awake”. It was all incredibly overwhelming, my head started pounding, I could hear every little sound and the world was spinning around me. She told me it was normal to get lightheaded when you were close to awakening. 

She told me she could tell I was close. That she could see it in my eyes, that I was close to awakening. She tried to break my aunt out of jail, she didn’t take a weapon, she just calmly told the guard my aunt got out today (she didnt), and the guard almost let her out. She posted a bunch of cryptic shit on facebook, trying to awaken our family. Things about needing to wake up, about gas not being real, about needing to start a revolution.

My sister got pretty angry when my mom talked about it. My mom told me she was close, that anger was part of it when you resisted waking up. She told me the night she had slammed things around, she was angry because she had been resisting. 

I heard my mom arguing with my sister. She was angry because she was “trying to save the world” and she told my sister that she was going to do everything to save the world for her kids.

She told me before now she had never been sure if she loved us. She told me that she had always never known if she was raising us to look good to other people or if she loved us, but that she knew now that she did love us.

I’ve been ignoring my friends, my girlfriend, everyone for the last 24 hours because of the amount of pure shock and confusion I’ve been in, and I just need to say something to anyone."	offmychest	2022-07-02T09:08:16.000Z	momthrowaway223
I think my boyfriend tearing me down.	com.example.redditnegative.model.RedditPost	2	1	"I (25F) have a bf (23M) who i met through a mutual friend through PlayStation and we have been dating for about 8 months. He travels to my state he’s been here three times and it’s great i love having him around and enjoy his company. I have yet to visit his state though. 
    
Lately he’s been really disrespectful. His ""jokes"" are really offensive and tasteless. When I get offended he’s annoyed or angry and says I take too much to heart. I’ve been in three other relationships with heavy Domestic V and a few times gRapE lucky to be alive.I care about him so much that I’ve shared with him things that I’m struggling with. He’s actually really caring and supportive on so much. My issue is that recently he’s so mean. Agressive and just i don’t want to be around him cause it will end in us sitting on FaceTime giving each other the silent treatment lol. But we talk every single day so i know it’s not like cheating or anything but idk what this change in mood and behavior is. I’d rather he break up with me than to keep treating me like shit.

It’s just lately he’s been really bad with insulting me and trying to laugh it off. I’m starting to feel overly sensitive. I’ve tried talking to him about it but it’s just still happening. I don’t know what to do at this point and I’m just about to say eff everything and everybody. Starting to feel like my old relationships just verbal and mental instead of physical but i might be wrong and overthinking everything. 

This might have been all over the place but felt right  to write it out somewhere."	offmychest	2022-07-02T08:53:20.000Z	kalyia96
I'm tired of these cringe youtube mobile gaming adverts.	com.example.redditnegative.model.RedditPost	0	1	"Why is it when I go to watch a video on Youtube I encounter such cringe? Bad acting, bad scripts, bad everything. The actors are terrible and the lines are cringe.

 I seen one today where two guys were at the front desk in a hotel room and both said at the exact same time ""I would like to upgrade to the presidential suite"". The cringy receptionist responds with ""We only have one presendentional suite left"". Yes, I spelled presendentional the way she said it above.

The two guys proceed to go at one another with how high of a level they are and the collection of characters they have. Then the receptionst starts acting turned on when she hears one guy has a certain character. 

Am I missing something here? Are they targeting a very specific audience with these adverts? I don't remember childrens adverts being so cringe, and I AM SICK OF THEM. Plus I'm not a kid anymore so I don't know how they're popping up, as my youtube history would not generally highlight that I have an interest in these. Any tips on how to get them to stop showing up? If anyone has any other cringe stories on these adverts, drop them below be funny to hear the cringe."	offmychest	2022-07-02T08:53:20.000Z	downrightscabby123
I feel nothing for my BF anymore	com.example.redditnegative.model.RedditPost	4	1	"We've known each other a long time. On/off history. We live together. 

My bf is an alcoholic. He's always been &amp; he said he's not gonna change &amp; I believe him. He used to at least try. The only thing he really adds to my life is money. I work too but he makes more. I would much rather have peace than more money. So while 2 incomes make life a little easier, the long list of ways he makes my life harder far outweighs extra money.

Trying to have conversations with him is more frustrating &amp; pointless than talking to a wall &amp; expecting it to say something. The only shred of respect I have left for him is that he's always worked. Even that seems barely meaningful now.

He rarely remembers conversations or his actions. He is not a partner at all. He's a drunk man baby that causes chaos, stress, destruction.

Most people like him. I used to but now I'm indifferent. I've always said he's a good person with a drinking problem. I won't be saying that anymore. He's not a bad person but the absence of bad does not make one good. I've always worked on myself, my issues &amp; will until the day I die. He hasn't made any consistent progress. He makes a little effort for a short time only to passify me just long enough. Hard to progress when you're drunk everyday.

I know I'm gonna leave him permanently &amp; blocked and I feel nothing. How does one have yrs of therapy, DUI's, arrests &amp; still not deal with your issues? How is there so little self improvement over so many yrs? 

Watching a grown ass man drunkenly stumble, fall, slur his words &amp; have no self control at all nearly every night is so very unattractive. 

I feel almost sedated. Even if I should feel bad, guilty, sad for him, I just don't care. Idc if he or anyone else thinks I'm a bad person for all this."	offmychest	2022-07-02T08:40:32.000Z	HunyBuny64
I'm So Tired	com.example.redditnegative.model.RedditPost	0	1	"I'm so tired of everything. I'm tired of my shitty job. I'm tired of constantly worrying. I'm tired of my endless self-loathing.

I just don't know what to do. I feel so defeated against everything. I already accepted long ago that I will never feel love and more recently realized I will likely never own my own place to live. Despite all this I don't want to kill myself, I just want to stop existing.

The worst part is that I don't even have any escapisms anymore. I don't enjoy anything anymore, just endless dread when it comes to everything I used to like. 

Sorry if this is very incoherent, it's mostly brain vomit. I just needed it out there, ya know?"	offmychest	2022-07-02T08:34:08.000Z	MagknoTheWise
