_id	_class	commentsCount	score	selftext	subreddit	time	user
Torn up and twisted	com.example.redditnegative.model.RedditPost		1	"I am struggling. Torn between two people, my ex and current beau. 

Almost feeling like I want to try again with my ex. He is moving away soon. Not sure if it's a good idea. Still have feelings for him. Thought i wanted to get rid of him but not sure if I do now. I am afraid we would end up having the same problems we had before. The timing of this is bad. I had a long time to try to reconcile. Might have waited too long. I was considering this before i knew about the move.  

I was waiting just a longer to see how this weekend goes and to see which way it's going with my current bf--moving forward or not....

I am going away with current beau this weekend. It was already pre planned and paid for. My heart is not completely in it though. Things seem a little wonky with him lately since we did the trial move in for 10 days. Not sure why.  

I am so confused and I hate that I am feeling this way."	offmychest		
New Sing Feature?	com.example.redditnegative.model.RedditPost		44	"I opened up the app and started to play a song and noticed a microphone icon where the lyrics button is usually located. It was like a game that monitored your voice. Amazing! Just what I want for the shower! Played two songs then it disappeared? 
Restarted the app and it was gone :(

Did I get an update by mistake?"	spotify		
Crazy bass pump up for gym (I need more songs like these)	com.example.redditnegative.model.RedditPost		2	""	spotify		
I’m a loser	com.example.redditnegative.model.RedditPost	1	3	"I have no one to tell this to and saying it out loud to myself isn’t working. I’m just particularly upset about this today and need to rant. 

I am a loser.

I (22f) don’t hang out with anyone anymore. Actually no one. Not friends anyway. I haven’t seen my middle/high school friend group (5 people) in almost a year.. also haven’t spoken with them except when it was their birthdays. The last time I hung out with my childhood bff (separate from the group) was March, before that was November. All I do is go to work and go home. Literally. The only social interaction I get is from my mom, dad, brother sometimes, my bff sometimes, coworkers (all 40+ parents with grandchildren) and employees at the stores I shop at.

I’m currently at the end of my gap year since graduating university before going back to school and having been working full time hours since last August. No vacations, just straight working.  Since then I have alienated myself I think. I sit at home and play sims and watch YouTube in my off time.

I don’t reach out because I’m too scared/ have a fear of them saying no, which I know is my own fault. They haven’t reached out to me either though. They hang out together … but without me. Either in twos or threes but I’m never included. I know this because they post it on their Instagram stories everytime they hang out. I kinda joke with myself everytime and say “thanks for the invite guys.” 

This might be a stupid reason but I think they don’t invite me because I’m not particularly close with anyone in the group anymore. We kinda lost that since graduating high school and then uni. Everyone has someone else you know.. Another reason may be because I don’t drink alcohol. It feels like every time they want to get together they want to get plastered drunk. And if I’m there not drinking anything, I ruin the mood because I’m introverted and not comfortable yelling and jumping and singing like they are when they are drunk. Why can’t we hang out without getting drunk? Getting drunk isn’t the problem, but every time?

Hopefully when I go back to school in September I can make some new friends (not meant to replace the ones I have now) and be social and push myself to hang out with people outside of work and school. 

I’ve also been single since June 2020 and haven’t had any interacting with guys at all since. My mom has been giving subtle hints that she wants me to date. She dated a lot when she was my age and I’ve only had 1 boyfriend. It makes me feel bad that I’m not living my life. I feel like I’m behind. I’m missing out. 

I understand that I can fix the problem I’m in … it’s  just really fucking hard to put myself out and the strike up conversations or to join clubs. I struggle even going out for walks by myself sometimes.

Something is wrong with me. I didn’t do anything to them as far as I know.. maybe they think I’m angry at them or don’t want to see them. Anyway..

Sorry for the novel.. I just wanted to say all this to someone."	offmychest	2022-07-01T13:45:36.000Z	AmI--Stoopis
Johnny Depp won't be Jack Sparrow, at least in his next movie role	com.example.redditnegative.model.RedditPost		12	""	movies		
Update on SolarGUI: v0.1.5 is out now	com.example.redditnegative.model.RedditPost	3	1	"In continuation to my previous post here ([SolarGUI v0.1.4](https://www.reddit.com/r/Python/comments/v72d59/update_on_solar_gui_v014/)), I now present SolarGUI v0.1.5

This version includes,

1. Observational parameters
2. Inclusion of major Moons of the planets
3. Images of Sun, the 8 planets, Moon, and Pluto.
4. Implementation of super() methods and more code refactoring.

GitHub: [https://github.com/AstrophysicsAndPython/SolarGUI](https://github.com/AstrophysicsAndPython/SolarGUI)

PyPI: [https://pypi.org/project/SolarGUI/](https://pypi.org/project/SolarGUI/)

Again, any suggestions, critiques, and feedback are appreciated."	Python	2022-06-27T20:26:40.000Z	AstrophysicsAndPy
Currently a developer but want to be a Product Designer	com.example.redditnegative.model.RedditPost		1	What is the career path for someone who is a developer and wants to break into product designer (digital). I want to design software no more coding. I want to focus on UI/UX.	jobs		
Advice for interviews in fashion retail?	com.example.redditnegative.model.RedditPost		1	"
I got invited to 2 different interviews in fashion retail, one at Superdry the other at Hollister. Hollister is for stock associate, Superdry for sales. Either would be my first job in retail. I just need something to last me through college, or at least the break.

I’m not sure if it’ll be a group interview, but I’m wondering is there any advice to help during these interviews? I’ve read posts saying “looks matters”. I’m not sure how much truth there is too that, as I wouldn’t consider myself ugly, but I’m not what would typically be considered “good looking”. I plan to dress business casual but add a little of my own flair.

Maybe I’m thinking too hard but job search for min wage jobs can be a pain in the city I live in, especially since I don’t have retail experience."	jobs		
I got terminated yesterday after coming back?	com.example.redditnegative.model.RedditPost		2	"I was quarantined for a whole week from 6/12 ( due to the fact I was diagnosed with covid and came back positive with a doctors note sent) and was specifically requested by regional manager to stay at home and not come to work until 6/21/22, and that rest of the week at work I had to put on a mask.

And on 6/21 I came to work on the clock, pm bought me to the office and given me the first write up. Saying these things and poor job work performance happened BEFORE my sick days. Which is completely not true, my pm praised me before I called in sick for Covid saying how much of a hard worker I am etc.

And than yesterday I got terminated.

Should I still sign up for unemployment at this point?"	jobs		
Can players at Wimbledon give their clothing stylized grass stains during a match for some color in their outfit?	com.example.redditnegative.model.RedditPost	6	8	If Kyrgios did a few running stomach slides to turn his shirt green, would the umpire ask that he change his shirt? What if he continued to “accidentally” do this and ran out of shirts? Would they let him play or would he need to retire due to lack of wardrobe?	tennis	2022-06-30T19:46:08.000Z	Makeitperfect
Your top guilty pleasure movies?	com.example.redditnegative.model.RedditPost		0	"Movie nerds of Reddit, what are your favorite guilty pleasure movies that you just need to indulge yourselves in from time to time? Cheesy romance, cheap horror or dumb action -- you name it!

For me, ""Blade Trinity"" is definitely up there. But the Schumacher Batman movies come in at a close second and third. Now it's your turn. I'm curious to hear about your guilty pleasure flicks and looking forward to adding new gems to my collection!"	movies		
I always run away from my problems	com.example.redditnegative.model.RedditPost		1	"I (13F) always run away from my problems. Not even trying to solve them. 

So, uh. I had a friend when I was like in fourth grade, she was the only person that would hang out with me since I was shy and didnt like talking to people much. Even if she was my friend, I didnt really like her.. She was manipulative, I always had to do what she wanted, or either she would take offense and talk shit about me to her friends, I really didnt like conflicts so I just shut up and did what she wanted. I always apologized, for every little thing, and 90% of the time it wasnt my fault. She had a bad day? I comforted her for hours. She would always vent to me about her problems, and then get mad at me. I stayed for her till 4am just so I could text with her. She would get mad at me for EVERY LITTLE thing in her life, it was always somehow my fault. I always told myself ,,Just a few more years and I'll leave her when I'll go to liceum after 8th grade'' (Liceum is like highschool) well I couldn't take it anymore so I just changed schools after 5th grade, I didnt talk with her about how I felt, I just left and blocked her everywhere. I ran away.

I also had a childhood friend, our moms knew each other so we were friends. We went to different school but we met pretty often. Our contact broke off after I became friends with that
girl ^, but after I changed schools we started hanging out again. At first it was like always, but then he started avoiding me (like in january this year) and would hang out with me only if his other friends werent available. He didnt answer my texts, and then text me if I wanna hang out even tho when I wanted he ignored me. Even if we finally go out he would bring 2-3 of other people from his school and pretty much just ignore me. I got sick of it after some months so I simply blocked him. Again, I didnt even try to solve our problem. I just left him. 

In my new school I dont have any friends, like no one. I ALWAYS sit alone, I dont have a person to even say stupid hello to. In home I just play games, I rarely go out, just to school, and its summer now so I dont go out at all. And I dont even try to make friends, I never tried. I let things be from the start, after summer Im going to 8th grade and I know things are gonna be the same. I dont want to change schools again so I just let things be. I guess I may have anxiety, my teacher wanted me to go to school psyhologist (or whatever its called, sorry I dont speak english) but I refused to and I dont try to change things at all."	offmychest		
I don’t agree with my therapist’s opinion	com.example.redditnegative.model.RedditPost		1	"I spoke to my therapist about a complicated situation where a friend abandoned our friendship at the worst time of my life. The friend has depression so my therapist kept emphasizing how depressed people can’t function while they’re going through an episode. I feel like this completely simplifies our situation. It makes me feel like my therapist thinks it’s alright for my friend to treat me poorly just because he has depression. I get that maybe the moment that bad stuff was going on with my life was the same moment he went through a struggle, but he has since come out of that and never reached out to me again.

In my opinion it’s not ok for my friend to treat me like shit just because he has depression. I went through depression myself and I didn’t treat people like shit. I just can’t get on board with my therapist’s assessment of this situation. After I provided more context it feels like she gave ok advice but still sorta failed to grasp the entire situation. Other than this she’s been a good therapist when we discussed other issues but this is very annoying to me."	offmychest		
I have no interest in dating black men.	com.example.redditnegative.model.RedditPost		3	"I really need to get this off my chest. This past year, I've  felt ridiculed, belittled and abandoned by black men. I'm done, because it's not worth it to continue providing for a community that has no interest in protecting me, growing with me, or thriving.

Social media has definitely been a big eye opener for me. I always thought it was me, that something was wrong with me that caused black men to treat me so horribly. And maybe there is, I'm not saying I'm perfect, but the amount of black women going through the same bullshit over and over again is sickening.

Black men do not care about black women. They like our bodies, they like the children we give them, but they have no respect for our lives, our bodies, and our time. 

And what makes it so sad, is that other races can see how horrible we're being treated but we can't. Men from other races acknowledge that black women are more driven and more successful then black men, but we still get treated like we're less than dirt.

The final straw was when that man forced a woman to  walk home because she wouldn't sleep with him. He took her on a date, a date she got an Uber to and paid for, but because she wouldn't sleep with her, he canceled the Uber he bought for her. She had to find a ride alone, at night, after drinking.

It was made worse when the men in the comments called her a gold digger because she didn't want to fuck a stranger. In other communities, men do not act like this. Sure, there's always one random guy who thinks he can treat women this way, but at least other men around them correct them. 

With black men, not only is it acceptable for men to treat us this way, but if we speak out against them, we're shunned, our accomplishments are belittled and we're called so many horrible things.

I'm okay if I never end up with a man. Honestly, I would prefer to be alone and continue with my career than settle with a man, birth children for him, and be left abandoned by him and laughed at by his friends.

Call me bitter, that's fine. I am bitter. I'm angry. I'm hurt. But I'm done rejecting the advances of other men to try and uphold this fantastical idea of creating a black household with a man who secretly hates me."	offmychest		
This month has S U C K E D	com.example.redditnegative.model.RedditPost		3	"Throwaway account because I know people who use this app. 

I don't even know why I'm bothering to write this. Just to get the words out I guess, and see if anyone can help surmount this overwhelmed feeling. But, fuck me, I can't catch any goddamn breaks. Just one shitty thing after another. 

The month *started out* with my mother getting a positive screening for lung cancer, y'know, the one that has a barely 50% survival rate five years after treatment. This has come after her smoking for the better part of 50 years, and I'm more upset than anything else at all the times I tried to get her to quit and how maybe that could've prevented this if she only stuck with it. I bargained with her, bought her vapes, even paid for her Chantix once, but she either conveniently lost it or forgot or some other excuse. She's tried to quit numerous times but keeps going back. 
Now that she has cancer, it's almost silly she's trying to quit now, as if that'll make everything better. Just doing too little, too late. Finding out a loved one has cancer is always an emotional roller coaster, but coming to terms with her mortality (And my own) and all the things that come with cancer treatment has been hard to accept, to say the least. It doesn't even seem like she wants to fight sometimes. That alone is really hard to stay positive about. I keep trying, but I don't even know what to say to her. I'm completely powerless to change anything and I hate it. 

Like a week after that, my great uncle passed away. It wasn't like it was unexpected because he was 95 and his health had been declining for a while, but he was my grandfather's brother. I never knew him because he died when I was really young, so he was my only connection to that past, so now that's been taken from me. 

I found out soon after that, my niece and nephew's mother *also* tested positive for cancer. I don't have a lot more information than that because I haven't talked to her, but I feel so bad for her kids. They've already lost so much. Their father, my cousin, was killed in a car accident before their sixth birthday, they've lost one of their uncles to drugs, their grandfather died several years back, and every man who's been a father figure has walked out on them. Now, their mother who's already paralyzed from the waist down and wheelchair bound, has another thing to keep her down. 

It was my birthday a week ago. Half the people in my own family forgot. None of my online friends said anything. With all the shit that already happened, I didn't even feel like celebrating. Certainly far from the best birthday I've ever had. 

Two days after that, I took my seven year old dog to the vet because she's been acting strange. She walks around the house aimlessly and stares at walls, and randomly will pee or poop on the carpet when this dog would sooner hold it for a week before. 
I spent half of my only day off during the week and over $500 at the vet running tests, only for them to tell me they had no idea what was wrong with her, except maybe a really bad infection. I found out yesterday when she went into a violent seizure that it's either epilepsy and she probably won't live past eight, or it's a brain tumor and her days are numbered even lower than that. 

I can feel myself just shutting down because of how much everything has been weighing on me. And that's only causing more problems because I'm talking to people less and less. I mean, even my girlfriend is pissed at me for basically falling off the grid. At least we've talked about it since and she's been understanding enough. 

And as a little more insult to injury, I'm in the middle of the worst poison ivy rash of my life and my skin is on fire constantly. 

Do you ever just wish you were someone else? Because I do. I can't deal with all this coming at me right now. Maybe one thing at a time might have been easier, but it feels like everything is just crashing down around me."	offmychest		
Tried venting a frustrating situation to a group of peers only to have multiple people criticize the way I manage my own business	com.example.redditnegative.model.RedditPost		1	"Some guy repeatedly called our office making a completely ridiculous demand. My employee handled the situation with grace, but he did keep her on the phone for a full hour and wasted our time. I wrote a post about it in a peer group with the point being this guy is ridiculous. I got more people commenting about how I shouldn’t have allowed him to waste so much of our time than people saying that guy’s demands made no sense.

I found myself having to stand up for my employee who had to deal with this jerk while my hands were tied doing other things. She could not leave without saying unprofessional things, which she did not do because she knows to maintain our image. If it was me on the phone I would’ve just told him to get lost because heck, I’m the boss. No one’s going to fire me so I don’t give a fuck and I’ll do the dirty work. Complaints against an employee I have to do something about, but no jerk customer’s going to complain about me to me and expect stuff to change.

Anyway my point is my peers kept telling me this guy isn’t worth the time, I need to train my employee better, or or prioritize differently. I initially just politely explained more details but it got to the point where they’re focusing more on what they think I’m doing wrong (like letting someone waste our time, and not training my employee better) rather than agreeing that this is a situation where the guy was nuts. I got tired of reading these comments that made me feel obligated to stand up for my employee who did nothing wrong.

Edit: a few missing words"	offmychest		
I found out my father molested my sister (and most likely me) as a child yesterday. I don't know what to do.	com.example.redditnegative.model.RedditPost		2	"Context: I am a female young adult. My family dynamic has always been chaotic and horrible, particularly due to my father and his side of the family. Though I think they are horrible people, I also just think they are severely mentally unstable/ill and are unaware of their behavior and/or refuse to get professional help. This behavior and trauma that it's inflicted upon the rest of my family is very apparent and already haunts me daily.

I have 3 siblings. One of whom is also female. all 3 are adults with their own families and lives. My mom and my dad finally got divorced recently, and i moved out with my mom. My father offered my sister to move in with him after me and my mother moved out. My sister called my mom about it in shock and said my father also *apologized* to her. This gutted my mom as she had not gotten a single apology from my father in all the years of abuse she had suffered, so she hung up mid-call. The two have been distance since. 

Yesterday: I went out with my sister to catch-up and the topic of my mother came up. My sister revealed that my dad admitted to molesting her in her sleep as a child, and that's what he had apologized for. My mom hung up before my sister could even finish that part. He also admitted that he has had a ""fetish"" for young girls. I instantly started crying. She does not want me to tell my mother despite my pleas, as she wants nothing to do with her. When trying to convince my mom to just *at least talk to my sister to see how she's doing* she refused and also said she wanted nothing to do with my sister. And i know if i told her outright, her reaction would be awful and my family would instantly fall apart (more than it already has).

I do not remember most of my childhood bc my brain prevents me from doing so. I have a lot of troubling memories flash through my mind occasionally but have never been able to dig further, and i trust it's because my brain does not want me to. I do remember in my early to late teens coming home to bed looking slept in, clothes rummaged through, and TV being used. I found out at that time it was my dad. I yelled at him about it bc I thought it was strange, but now looking back i fear that that + my troubling repressed memories involve my dad and his sick pedophilia.

I've been extremely depressed and suicidal. All i've been thinking about is how my own father violated my sister and probably me. Even if not me, the notion that he might've thought about the idea enough to sleep in my room and go through my clothes horrifies me. I haven't been able to tell anybody, as the ramifications could worsen my own mental state and further ruin the mental state of my family + cause a domino effect of awful events. 

I want justice for my sister. I feel like my mom has the right to know. But they hate each other too much for the outcome to be positive. I never want to see my dad again. I cannot afford a therapist. I just really want to die. 

Some details have been omitted that make the situation much worse for me, but i'm afraid to get anymore specific in case this post receives more attention than anticipated."	offmychest		
numbness ?	com.example.redditnegative.model.RedditPost		1	"I feel like I'm just very much immune to everyone's thoughts and opinions about me and I hate it. Like, if someone pinpoints anything about my appearance I just let it slide. I hate that I don't say anything just so I can maintain peace in the situation. I feel like I'm so mentally and emotionally exhausted that literally just don't care about anything anymore. I don't care about how I look, how I smell, how my grades are. I'm just living at this point. I don't even know how I look anymore. 

I feel like I'm never ever going to feel pretty. Most compliments feel shallow. The amount of insults that I've got about my appearance as a kid for being a brown girl in a majority white populated school are probably the reason I feel this way. It's just so exhausting to just never feel confident in yourself.

Someone confessed their feelings to me and I was just in utter disbelief that anyone would even see me in such way. I genuinely don't see what they saw in me. I'm just extremely unattractive and irritating. There's nothing interesting to me. I'm just a teenager who stays home all day because they have no energy to even get out of bed.

I'm so afraid of the future too , like I know im not getting anywhere because I literally have no energy or motivation left in me. My parents expect so much from me and here I am failing every single obstacle life shoves at me. The fact that everyone around me has had a major change in their life and here I am doing absolutely nothing is just crushing me."	offmychest		
Fuck you.	com.example.redditnegative.model.RedditPost		4	Thats really all I have to say anymore.	offmychest		
