_id	_class	commentsCount	score	selftext	subreddit	time	user
Do other companies prorate salary based on remote location?	com.example.redditnegative.model.RedditPost	4	2	Found an official document from HR at my internship describing their prorating calculations that are essentially based on location. Wondering if other companies do this?	cscareerquestions	2022-07-01T04:45:52.000Z	darmfinger
I hate reviewing co-worker’s PRs since he’s so rude with comments	com.example.redditnegative.model.RedditPost		963	"He asked me to review his PR and every time I comment something, he reacts condescendingly and aggressive. One example is I asked him to comment his functions on what it does since all the other functions have comments. He responded by accusing me of being too lazy to understand his functions and that told me to use google. Other times I comment on his code, he accuses me of not understanding how proper code looks.

My personality generally leads me to avoid confrontation. I’ve been trying to avoid commenting on his PRs in hopes he bothers someone else but he keeps reaching out to me so I have to deal with his aggressive comments.

What’s the best way to get out of this situation without escalating it? I really hate reading his replies back to my comment and don’t want to keep receiving snarky comments."	cscareerquestions		
What are some common PR mistakes that you’ve seen devs make?	com.example.redditnegative.model.RedditPost	9	4	Looking to avoid some common pitfalls.	cscareerquestions	2022-06-30T21:49:52.000Z	Prestigious_Passion
Asked to give 6 weeks notice?	com.example.redditnegative.model.RedditPost	7	1	"My company asks for 3 weeks. 

They are having difficulty finding a replacement.  They asked me to stay another 3 weeks.

To me that’s a bit crazy. 

3 weeks is already longer than normal.  Maybe 1 extra week is okay,  but seriously I just want to move on because I was not happy there.

I want to leave in good terms,  but to me 6 weeks notice seems ridiculous."	cscareerquestions	2022-07-01T04:09:36.000Z	Lopsided_Reading_362
Has any of you gotten severance when getting fired?	com.example.redditnegative.model.RedditPost	4	2	"I might be getting fired tomorrow cause my boss is an asshole, but that's beside the point. I read that since the company is in California they must give me severance? Has any of you gotten any? Or is it all smokes? 

Also any advice not to be so anxious. I can't sleep and feel like shit. I already have an interview next Wednesday so I won't starve but it's still not helping. I am talking to a therapist already. 

I will make sure to name and shame the company in a few weeks. Freaking frat house."	cscareerquestions	2022-07-01T01:40:16.000Z	baduk_is_life
What do you do on days where you just can't focus?	com.example.redditnegative.model.RedditPost		8	"So, every now and then I have one of those days where I can't just focus on the task at hand. It's not that I don't feel like doing it, or that I'm distracted by something: it's like I'm trying to focus but my brain is spinning its wheels in the mud and I cannot get the problem inside my head. The usual tactic of breaking the problem down on smaller problems does not work because the smallest division possible still requires a good amount of focus.

In these situations I'd leave it and use that time to get some mindless tasks out of the way, but we barely have any of those at my current job, so that's a no go.

Just leaving is not an option. Not doing anything is not an option either because I need to always report something at the end of the day (we do a sort of unofficial Kanban where we just pick tasks and work on them until the project is done eventually).

Here's a few things I tried, that sometimes do work, but do not on those days.

* The Pomodoro technique. This one helps immensely on most days, but those days it just ends up in 25 minutes of staring at the screen trying to not look at the clock.
* Going for a walk. I'm still unfocused after coming back.
* Exercise. It just makes me unfocused AND physically tired.
* Caffeine. Can easily backfire into being unfocused and extra anxious about it.
* Meditation. My mind may get cleared of thoughts for a moment, but the problem still can't seem to enter it. I have only tried the basic ""count your breaths, clear your head, focus on your environment"" meditation, I'm no meditation expert.
* Videogames, reddit, youtube or other entertainment. It can make my focus even worse.
* Music. It can make tedious tasks easier but does not help when I just can't focus.

In case you're wondering, I eat decently healthy, exercise regularly and sleep well, and those factors remain on the good days where I'm very productive, so that isn't it.

I'm at a loss on what to do. Do any of you have some technique that I haven't tried? Because these days are extremely frustrating and go by very slowly."	cscareerquestions		
Indeed assessment	com.example.redditnegative.model.RedditPost	13	0	"Hi guys, sorry if this is a question that’s already been answered, but what do you think about indeed assessments? I got 2 “proficient” (in writing and typing lol) and I’m wondering if I should make them visible or not? I’m a pretty good writer normally, and I wouldn’t say I’m a terrible typer (55 WPM 100% accuracy) so I wouldn’t want to make myself look worse than I actually am.

What do you think? Should I just keep them private and only publish expert and highly proficient?"	cscareerquestions	2022-06-30T20:01:04.000Z	freddDeeP
Interview Discussion - June 30, 2022	com.example.redditnegative.model.RedditPost		12	"Please use this thread to have discussions about interviews, interviewing, and interview prep. Posts focusing solely on interviews created outside of this thread will probably be removed.
        
Abide by the rules, don't be a jerk.
        
This thread is posted each **Monday and Thursday at midnight PST**. Previous Interview Discussion threads can be found [here](https://www.reddit.com/r/cscareerquestions/search?q=Interview+Discussion&amp;restrict_sr=on&amp;sort=new&amp;t=all)."	cscareerquestions		
Should I decline the offer now or wait?	com.example.redditnegative.model.RedditPost	6	1	" 

So I have been applying for internships and interviewing for about 2 months now, and last Monday I got an offer from a very shady company, it's UK based, but operates offshoring services in my country, it's remote which I think is not ideal for an undergraduate looking to expand their skills. Also, the offer was verbal since I don't think they have an office in my country, so there won't be any signing and stuff.

So yesterday I got another verbal offer from a reputable company in my country, it's 4 days/week and not WFH, which I like.

The pay is 3x what the UK company is offering, but the only problem is that I am supposed to start with the UK company next Saturday and the other company said the offer will be ready on Sunday, I only got a verbal offer from them.

So what should I do, should I tell the first company I changed my mind and risk not getting a written offer from the second company if they for whatever reason decided to change their mind, or should I start working for the first company and leave when the second offer comes?

Position is Full Stack Developer Intern in both companies.

Sorry for the bad formatting."	cscareerquestions	2022-06-30T17:18:56.000Z	FaroukAmr
Daily Chat Thread - June 30, 2022	com.example.redditnegative.model.RedditPost		6	"Please use this thread to chat, have casual discussions, and ask casual questions. Moderation will be light, but don't be a jerk.

This thread is posted **every day at midnight PST**. Previous Daily Chat Threads can be found [here](https://www.reddit.com/r/cscareerquestions/search?q=Daily+Chat+Thread&amp;restrict_sr=on&amp;sort=new&amp;t=all)."	cscareerquestions		
Referral Confirmation	com.example.redditnegative.model.RedditPost	5	0	"Does Amazon send an email confirmation after being referred by an employee?

I asked a classmate to refer me for a job at Amazon and they told that they did it. It's been few days and I didn't get any email from Amazon that I was referred for the job.

Is this common and should I take their word that I have been referred? Or should I find other people to refer me for the same job?

Thank in advance!"	cscareerquestions	2022-06-30T15:45:04.000Z	kat-mobile
Parents outraged at school board members for dismissing book on Japanese American incarceration during WWII	com.example.redditnegative.model.RedditPost	871	13293	""	news	2022-07-01T01:48:48.000Z	Zen1
Jackson sworn in, becomes 1st Black woman on Supreme Court	com.example.redditnegative.model.RedditPost	2825	66772	""	news	2022-06-30T16:14:56.000Z	Own_Ad6388
BBC - US stocks see worst first half drop in more than 50 years	com.example.redditnegative.model.RedditPost	227	1807	""	news	2022-07-01T10:14:24.000Z	KLFisBack
Community gathers after Pacifica school's pride flag burned, as hate crimes rise across CA	com.example.redditnegative.model.RedditPost	59	918	""	news	2022-06-30T23:15:12.000Z	benfelix1
At least 6 migrants died, 10 others rescued, in 3 separate human smuggling cases in Texas over the last 24 hours	com.example.redditnegative.model.RedditPost	72	391	""	news	2022-07-01T02:10:08.000Z	DownToeartgh
Russia abandons Black Sea outpost of Snake Island in victory for Ukraine	com.example.redditnegative.model.RedditPost		457	""	news		
Paola man sentenced to 27 months for hate crime against Black boy	com.example.redditnegative.model.RedditPost	25	322	""	news	2022-06-30T23:10:56.000Z	benfelix1
S&amp;P 500 posts worst first half since 1970, Nasdaq falls more than 1% to end the quarter	com.example.redditnegative.model.RedditPost	58	286	""	news	2022-06-30T20:07:28.000Z	fabreasycheesy
Lockdown in Indian city after gruesome sectarian killing by Muslim men	com.example.redditnegative.model.RedditPost	92	479	""	news	2022-07-01T11:46:08.000Z	The-6ix
University of Toronto makes history with launch of new degree in Black health	com.example.redditnegative.model.RedditPost	94	125	""	news	2022-07-01T03:44:00.000Z	Chiryder
Federal agents arrest former Ohio National Guard member for making and selling ‘ghost guns’	com.example.redditnegative.model.RedditPost	213	3531	""	news	2022-06-30T01:36:00.000Z	Fun_Investigator_478
1955 warrant in Emmett Till case found, family seeks arrest	com.example.redditnegative.model.RedditPost	430	5617	""	news	2022-06-29T20:26:40.000Z	davsx69
Russian forces withdraw from Black Sea's strategic Snake Island	com.example.redditnegative.model.RedditPost	29	469	""	news	2022-06-30T09:23:12.000Z	martianruby
Qatar fails to offer World Cup safety guarantees to LGBTQ+ fans | World Cup 2022	com.example.redditnegative.model.RedditPost	1311	11962	""	news	2022-06-29T15:25:52.000Z	proximalfunk
After ‘threats,’ drag queen event moved at West Hartford Pride festival, organizer says	com.example.redditnegative.model.RedditPost	400	1197	""	news	2022-06-29T23:08:48.000Z	benfelix1
"A ""coin flip"": Nearly half of U.S. murders go unsolved as cases rise"	com.example.redditnegative.model.RedditPost		7543	""	news		
Man exonerated after 33 years in prison is back behind bars	com.example.redditnegative.model.RedditPost	332	778	""	news	2022-06-29T22:43:12.000Z	trident-of-poseidon
3 Americans found dead at a Sandals in the Bahamas last month died due to carbon monoxide poisoning, police say	com.example.redditnegative.model.RedditPost	19	208	""	news	2022-07-02T11:58:56.000Z	Olivia_20021
Oakland police chase suspect, flee scene after deadly crash, sources say	com.example.redditnegative.model.RedditPost	28	115	""	news	2022-06-30T04:56:32.000Z	Chiryder
LAWSUIT: Female inmates were assaulted, raped in Clark County jail	com.example.redditnegative.model.RedditPost		3412	""	news		
Mychelle Johnson (Miles Bridges’ wife) on Instagram: I hate that it has come to this but I can’t be silent anymore.	com.example.redditnegative.model.RedditPost		20571	"“I hate that it has come to this but I can’t be silent anymore. I’ve allowed someone to destroy my home, abuse me in every way possible and traumatize our kids for life. I have nothing to prove to the world, but I won’t allow anyone who could do something so horrible to have no remorse and paint a picture of something I’m not. I won’t allow the people around him to continue to silence me and continue to lie to protect this person. It’s unethical, it’s immoral, it’s truly SICK. It hurts my heart because I’ve always had hope, and so much love and as scary as this is for me to do it’s time I stand up for myself. I won’t be silent to protect others anymore because I value myself and my kids more than anyones ‘image’.… a fracture nose, wrist, torn eardrum, torn muscles in my neck from being choked until i went to sleep and a severe concussion. I don’t need sympathy, I just don’t want this happening to anyone else, I just want this person to get help, my kids deserve better. That’s all i want. It hurts, everything hurts, this situation hurts, most importantly I’m scared and hurting for my kids who were witness to everything. Please respect my families privacy and stop with the disgusting rumors and allegations”

https://www.instagram.com/p/CfdGh08jdvz/

**EDIT:** Just a warning, the Instagram link contains pictures which may be sensitive to some."	nba		
People shit on LeBron for switching teams…but at least he delivered a championship to every team he’s been on	com.example.redditnegative.model.RedditPost		13310	"
LeBron made a 3-1 comeback in the Finals against a 73-9 team with Kyrie. KD couldn’t even last two proper seasons with him before requesting a trade. As soon as things get tough, KD goes around building teams that can't lose. 

LeBron joins his friends to beat his enemies. Durant joins his enemies to beat his friends. Major difference. One still shows respect to the spirit of competition, the other completely disregards competition &amp; what sports are supposed to be about.

TLDR: Durant has done more damage to his sport than any other athlete ever has and people let him get away with it because they have such an irrational hatred for LeBron. It's sick."	nba		
[Highlight] Paolo Banchero posting a photoshop of him and KD in Orlando uniform is shown to which RJ comments : 'I hate to break it to you, but if that happens you're going to be in Brooklyn bro'	com.example.redditnegative.model.RedditPost		6696	""	nba		
Ben Simmons on playing with Kyrie and KD. 'Its going to be Scary' They havent played a single game together	com.example.redditnegative.model.RedditPost		6020	""	nba		
It's not nba but last night I saw the most insane bounce on a dunk in the fiba qualifiers	com.example.redditnegative.model.RedditPost	74	1916	""	nba	2022-07-01T11:05:36.000Z	nuuskatonttu
With KD requesting a trade from Brooklyn, a reminder the Nets Picks that Houston owns: 2023 first-round pick swap. 2024 first-round pick. 2025 first-round pick swap. 2026 first-round pick. 2027 first-round pick swap. Every single one is UNPROTECTED.	com.example.redditnegative.model.RedditPost		3803	"The Nets acquired the three-time scoring champion from the Houston Rockets on Wednesday in a move he has sought for weeks. The trade also involves the Cleveland Cavaliers.

In the trade, the Nets send center Jarrett Allen and forward Taurean Prince to Cleveland, and guard Caris LeVert and forward Rodions Kurucs, as well as three first round draft picks (2022, 2024 and 2026) and four first round pick swaps (2021, 2023, 2025 and 2027) to Houston. 

The Rockets also receive guard Dante Exum and a 2022 first round draft pick from Cleveland (via Milwaukee), and Brooklyn acquires a 2024 second round draft pick from the Cavaliers to complete the deal."	nba		
Day 13 of Goated Playoff Performances till the season starts: Jamal Murray 50/5/6 to force a game 7, 2020 Game 6 Utah vs Denver	com.example.redditnegative.model.RedditPost		205	""	nba		
[MacMahon] JaVale McGee told ESPN that he expects to be Dallas’ starting center. He will reunite with head coach Jason Kidd and assistant coach Jared Dudley, who were part of a Lakers’ title run with McGee.	com.example.redditnegative.model.RedditPost		573	""	nba		
The Cavs needed the Kings to not be terrible just one time in a 6 year period in order to convey a first round pick… and it didn’t happen #Kangz	com.example.redditnegative.model.RedditPost		446	"From the JJ Hickson trade.  Basically trust needed them to not be a bottom 1/3 team just once 

“Will get a first-round pick in addition, although the pick is lottery-protected in 2012. The pick is then protected in 2013 (1-13), 2014 (1-12) and 2015-2017 (1-10). If the pick is not conveyed by 2017, then Sacramento will convey its 2017 second-round draft pick to the Cavaliers protected (56-60.)”


https://www.cleveland.com/cavs/2011/06/cavs_may_trade_jj_hickson_to_k.html"	nba		
"In 2017, Pelinka signed Klutch client KCP to a 1 year, $18 million deal: He compared it to ""the book of genesis when the Israelites wandered in the desert and bread came down from heaven"". In 2022, 8 of the 12 Laker roster are now Klutch clients."	com.example.redditnegative.model.RedditPost		484	""	nba		
Complaint mega thread [lyrics + excessive ads]	com.example.redditnegative.model.RedditPost		648	Please keep complaints and posts about lyrics and excessive ads within this thread. Posts concerning these issues will be deleted. This subreddit is mainly for sharing playlists.	spotify		
Can't play albums	com.example.redditnegative.model.RedditPost		1	Just wondering if anyone has a fix for this. I have premium, and I can't play albums for some reason. I can play playlists and individual tracks in playlists, but when I click play on an album, or try to play a track from an album specifically, nothing happens and the play button and track info bar go grey. I've tried uninstalling and reinstalling and restarting my computer but nothing seems works.	spotify		
Radical Islamist on Spotify?	com.example.redditnegative.model.RedditPost		0	"I was listening to my weekly mix which mainly consisted of hardstyle but the last song was ""El Djihad"" by El Azhar.
I don't speak arabic but this somehow shocked me. Maybe I'm just ignorant but is this song by a radical Islamist? And if so, why does Spotify not check first?

Link:
 https://open.spotify.com/track/75ER3Jh1qsObUBrekzwoyu?si=ekMw83K9TM2ZqX-f8W1XQQ&amp;utm_source=copy-link&amp;context=spotify%3Aplaylist%3A37i9dQZEVXcBXiBqHN3ZtF

Link to my mix:

https://open.spotify.com/playlist/37i9dQZEVXcBXiBqHN3ZtF?si=cDFWswCsSOuGDjUPComWcA&amp;utm_source=copy-link"	spotify		
Playlist minutes?	com.example.redditnegative.model.RedditPost	35	59	"Something strange I’ve noticed with some of my playlists is that the length of the playlist is shortening even though the song number is still the same. 

I have a playlist which was 24hrs and 1 minute with 379 songs. Then it shortened down to 23hrs and 52 minutes with 379 songs. Now it’s at 23hrs and 50 minutes with 379 songs. 

I have not touched, added or removed songs in the playlist and unavailable songs are not hidden. Was curious if anyone else has had this occur to them and what the explanation might be"	spotify	2022-06-30T11:05:36.000Z	jessKa99
0:29 song length	com.example.redditnegative.model.RedditPost		23	Is anybody else having a problem where random albums have had all their songs changed to 0:29 seconds?	spotify		
Vibe, hard to explain, but vibe	com.example.redditnegative.model.RedditPost	0	0	""	spotify	2022-07-01T06:41:04.000Z	Alexknikolic
Sad hip hop	com.example.redditnegative.model.RedditPost	0	1	""	spotify	2022-07-01T06:36:48.000Z	Alexknikolic
Bad bitch music	com.example.redditnegative.model.RedditPost	0	0	""	spotify	2022-07-01T06:34:40.000Z	Alexknikolic
its the second time this month I've been forced logout and my off line premium downloaded deleted, who else experiences same and what's the solution please	com.example.redditnegative.model.RedditPost		5	""	spotify		
Summer Jammin' - A soundtrack for any summer occasion. Hip Hop. Reggae. Alternative. Funky Shit. Summer classics.	com.example.redditnegative.model.RedditPost	0	1	""	spotify	2022-07-01T05:49:52.000Z	Playlist_Portal
Need help with claiming profile (tunecore)	com.example.redditnegative.model.RedditPost		1	"Apologies if this is a basic question.

I've been in a circular reference - my first track has been published on spotify, and when I try to go through the ""claim artist"" webpath from spotify, it takes me to my tunecore and says to do it through them, saying it should be instant.

When i go through the link provided by tunecore, it gives the same webpage, saying look for the ""artists for spotify banner"" which I cannot see - I tried logging out of every spotify account I have, tried googling to find an alternate path, can't find my way to any landing page with that option.

I was hoping to get acccess before the weekend of the 4th to change artist art, get access for bio etc, but a little lost. sorry if this is a dumb question. can provide screenshots if anybody has ideas

&amp;#x200B;

And, i can indeed find my music posted on spotify - so it isn't an issue of the music not being available. Tunecore also has the ""live"" notification by the single "	spotify		
New need some help	com.example.redditnegative.model.RedditPost		1	Basically I want to play an single from an artist and whenever I click it and hit the play button is plays other songs by the person.I just want to play that one certain song not some other song from the same artist.It’s annoying af and I need some help??	spotify		
Launching issue after Re-install	com.example.redditnegative.model.RedditPost		1	After reinstalling the app to attempt to get the blend feature to work with my friends, the app no longer launches, instead I am presented with a grey screen with the logo on it and nothing else, I have tried reinstalling again, clearing both the app and my phones caches, and reloading in through the web page on my phone, is anyone else having this issue or know of a solution? I've tried it all besides resetting my phone. (Galaxy s9)	spotify		
Spotify Visual Glitch - 0:29	com.example.redditnegative.model.RedditPost		2	So for some reason, various songs and their whole albums  (including Avicii's Stories album, Michael Jackson's Bad 25th Anniversary album, Beyonce's 4 album among others) have a bug in which the song length is only 29 seconds long. It's not whole artists, just albums. I think it's really odd and am wondering if anyone else has experienced this? If you know about it, do you know how it can be solved. I know it's not that big a deal, but it's just strange.	spotify		
My spotify is stuck on a gray screen with the logo and won't do anything. how can I fix this? I've tried a few different things	com.example.redditnegative.model.RedditPost		1	""	spotify		
Spotify playing random songs instead of what's on my playlist	com.example.redditnegative.model.RedditPost		1	Hi, Spotify is playing random songs from other artists instead of playing the songs on my playlist. How do I solve this? I have premium.	spotify		
Can't start app on phone after buying premium? grey screen with logo	com.example.redditnegative.model.RedditPost		1	""	spotify		
Songs Disappearing	com.example.redditnegative.model.RedditPost		1	I have a playlist that was at around 100h and 30 something minutes. I looked at the playlist today though, and it's at 99h and 57 mins. I didn't remove anything and there's no tracks that were taken down (I have unavailable tracks set to visible). I have no idea what got removed and why. I have over 1700 songs so I don't have the time right now to even attempt to discern what was removed. I'm just confused why this is.	spotify		
It's really annoying, I prefer to choose my music	com.example.redditnegative.model.RedditPost		0	Can somebody explain to me why Spotify adds random songs to my playlist on its own? Is this something I can reverse with premium because it pisses me off especially considering without premium I only get 6 skips an hour.	spotify		
Smooth &amp; chilled but sad lyrics	com.example.redditnegative.model.RedditPost	0	1	""	spotify	2022-06-29T23:49:20.000Z	phluk3-
Songs from mafia movies. From the late 50s all the way to mid 80s.	com.example.redditnegative.model.RedditPost	2	60	""	spotify	2022-06-28T21:37:04.000Z	KungFuCold
Crazy bass for driving/cruising (recommend me more songs)	com.example.redditnegative.model.RedditPost	2	2	""	spotify	2022-06-29T02:03:44.000Z	phluk3-
House music (heavy bass) - please help make this playlist longer	com.example.redditnegative.model.RedditPost	0	2	""	spotify	2022-06-29T01:16:48.000Z	phluk3-
bunch of emo/emo adjacent shit | genres: emo, pop punk, metalcore, screamo, scene/scemo, crunkcore, etc.	com.example.redditnegative.model.RedditPost	2	5	""	spotify	2022-06-28T20:26:40.000Z	uriellygolden
Where’s all the job openings?	com.example.redditnegative.model.RedditPost	82	78	I read a report recently that said there are two open jobs for every job seeking person in the US. I’ve applied to at least 100 jobs I’m qualified/overqualified for since Christmas and haven’t heard back from anyone, not even a rejection. Explain that.	jobs	2022-07-01T01:59:28.000Z	NoSite4
