_id	_class	commentsCount	score	selftext	subreddit	time	user
I feel so lonely and lost	com.example.redditnegative.model.RedditPost	0	1	For the last couple of years, I (30 F) feel like I've been spiraling out of control. I recently graduated from college - after dropping out years ago - and I can't find a job anywhere (I have a part-time job, but I can't make a living out of it) and this makes me feel like a complete failure. All of my friends already have jobs and have moved out of their parents house, but I am stuck. I feel like I can't talk about this with anyone because none of my friends would talk to me whenever I bring the topic, or I try to talk about these feelings. I have listened to them whenever they needed to vent about their jobs, or a promotion that was stressing them out, their struggles, their love lives, etc. I'm a notorious introvert, so it's not like I bring this out a lot, and I have also struggled with depression and suicidal thoughts in the past. I feel completely lonely and lost, and I don't know how to deal with this anymore or how to confront them about this.	offmychest	2022-07-01T16:34:08.000Z	bibibang
My life’s never getting better	com.example.redditnegative.model.RedditPost	2	1	I can’t see my life ever getting better. I’m mid 20s living with my parents working from home in a shit marketing job that pays minimum wage. Applied for other jobs but I’m not experienced enough apparently and I have no friends. Weekends are the worst I just sleep through them to avoid thinking about how lonely I am. I want to experience what everyone else is at my age. Everyone’s travelling, falling in love, making memories. I’m stuck at home because I have family members still obsessed with covid so I can’t go to any hobbies etc to meet people. Every Friday i slip into this depressive state.	offmychest	2022-07-01T16:32:00.000Z	lalunebby
I hate myself	com.example.redditnegative.model.RedditPost	0	1	That’s all. I’m sorry this is short. Have a good day.	offmychest	2022-07-01T16:32:00.000Z	themiamian
My girlfriend doesn’t respond to my texts even tho she have time to	com.example.redditnegative.model.RedditPost	1	2	"
Often when I just send a simple question or a love message she sees it but won’t reply. I know this because she sends me TikToks and dms after I’ve been sending the message. I get it if she doesn’t have time or other things to do but when she actually have time it feels like she’s just ignoring me. A bit annoying I might should say something?"	offmychest	2022-07-01T16:32:00.000Z	InternationalRice944
I am angry for putting in so much effort and not receiving any emotional support.	com.example.redditnegative.model.RedditPost	3	2	"I am angry. So angry I‘m crying right now in fact. My brother has always been a person who‘s mooching off your back and never put in much effort while my mom applauded his intelligence. “He has so much potential!” “He could get such good grades- he’s just lazy.”. No one ever outwardly said anything but I always felt the expectations to be better. To achieve more. So I did. I tried to get the best grades possible, to get a good degree but it all came to ahead a few days ago when I got so burnt out I failed and didn’t graduate- I got a second chance to re-do my math exam on monday though. So now to the main issue at hand, I am going to take my Cambridge Language Exam tomorrow and told my family how nervous I am. My brother refuses to join me tomorrow morning for mental support and my mom just told me she has other plans with our grandma. I was confused as I told her about the time she left me at an important competition 4 years ago and how I failed because I felt so abandoned and nervous and sad. I also told her I informed her about the date weeks ago and how disappointed I am.

No matter what academic success I have my mom always makes it about her and how much she helped me but none of this is true. I don’t care about monetary support. I just want someone to believe in me and to encourage me. I hate it."	offmychest	2022-07-01T16:27:44.000Z	cherryl3monade
I don’t feel like I belong	com.example.redditnegative.model.RedditPost	3	2	My friends are competitive with video games and for the majority of my life I’ve played casually. But over quarantine I got into competition with some of them and I do enjoy it! But I’m also very hard on myself. I’ve been in therapy for a while and am working really hard to improve the internalized negativity but I have my moments where I get overwhelmed or upset and either cry or step back so I can reflect and self soothe. My friends keep playing a lot and they keep getting better and I’m happy for them. But they’re farther ahead than me and the game won’t actually let us play ranked together anymore because of the difference in our levels. Last night I was invited to watch them play and initially I knew it would upset me because I wasn’t able to play with them- but I joined the call to try and learn something and see how well I could manage my feelings. I did learn some things but as I expected, I felt sad that I couldn’t play with them. I swear to god when I’m feeling low and want to talk to someone if any of them are playing their games my messages are pointless. They don’t get seen until hours later, if at all. I don’t have many people in my support system anymore so dealing with these emotions on my own has been hard. There’s 2 people that reach out to me often but I am not close with them and it is NOT a good idea for me to be close to them. I’m Long story, but it’s a danger to my mental health. I hate seeing these people who I don’t want to be close with reaching out in these low times.  I just don’t feel like I belong anymore.	offmychest	2022-07-01T16:19:12.000Z	clementinedaisy
Sorry I couldn't reply yesterday	com.example.redditnegative.model.RedditPost	4	6	"Hello. I'm the OP from yesterday that was convicted (tried to link to the original post, but subreddit rules don't allow it).

A lot of people had questions for me and were asking for more details of the case. I was intending to answer them, but unfortunately I didn't make it back in time before the post was locked. So I'm posting this now in case anyone still wants information. I can't be online all day, but I'll try to check back every couple of hours or so.

As someone mentioned yesterday, I do have my DMs turned off. I chose to do this as a preventative measure against any possible hate mail or threats, as I'm not in a good enough place to handle those right now. I'm sorry if you wanted to reach out to me directly. I'm immensely grateful to everyone that offered me words of comfort and support yesterday and am so sorry I couldn't reply to your comments individually. Also for the awards, which tbh I don't really know what they do, but I do know they are also a show of support and kindness.

This will probably be my last attempt to talk about this--at least on Reddit. If this post also gets locked or deleted, I don't plan to try again. Just not willing to put that amount of effort into something that's causing me suffering anyway. And in a similar vein--just so everyone knows--I am planning to probably delete these posts and this throwaway account within a week. My aim in posting here was to get this ""off my chest,"" and now that that has been done I'm not sure it's helping me to leave the story up here perpetually. Idk, I'm still deciding.

Thank you everyone that has been kind to me."	offmychest	2022-07-01T16:17:04.000Z	anon7956
Brothers Insanity cost me everything	com.example.redditnegative.model.RedditPost	0	1	"Throwaway account

I’m sick of the feeling of isolation, in the past two years I’ve lost nearly everyone, i still have friends but they have different groups that they spend more time with than with the group i have left. The pandemic didn’t even factor in to my newfound isolation the family situation has been fucking rough, I’ve sacrificed my teenage years to steer the shitship that is my home through family illness, my brother literally going insane and I did all of this without ever asking for reward and what has come from it? Nothing that benefits me, during the time my brother was undiagnosed and untreated i spent all day, everyday in a severe state of panic knowing that at any moment I may receive that call letting me know he was dead or that he had killed someone else he blamed me for all of his problems, woke me up every morning for weeks on end trying to start a fight or lay new unsubstantiated accusations that he perceived to be rational. he broke through my bedroom door (literally) and his own. he would punch, kick and scream his way to his desired objectives while tearing me down in-front of my friends trying his absolute best to humiliate and degrade at every possible step and his campaign worked, no one outside my close circle wants anything to do with me because of sins i never committed.

I want out, i want peace, i need my life back but the damage is done - so i sit here alone, and miserable because I done the right thing by not embracing insanity and keeping my family together."	offmychest	2022-07-01T16:10:40.000Z	Stockimage11
I hate my niece	com.example.redditnegative.model.RedditPost	5	0	"She’s only 8 months but I dont like her. I hate that she won’t stop touching me or sleep for more than 30 minutes. I hate that’s she’s always whining and won’t stop touching everything I have. I’m not even sure I love her. I babysit her almost everyday a week and I see her on the weekends. She’s always around and it’s so frustrating because no one understands that I don’t like kids. They think it’s a joke but it’s true i hate them. I hate them so much. Sometimes I wish she was never born. I hate the way she can’t speak to me and doesn’t listen. She doesn’t know boundaries and she won’t stop grabbing me. I hate her. I don’t love her. I don’t feel anything other than dislike for her. 

I know it’s wrong and she’s only a baby but she ruined my life. I can’t even enjoy my summer because I have to babysit her and it sucks so much but I don’t want to tell my mom because then everyone will think I’m being a dick. I didn’t sign up for this, I hate my family for making me do this. It’s so emotionally and mentally draining. I already struggle with depression and suicidal thoughts, add the overwhelming emotions that come with having a screaming baby. It makes me want to kill my self. Too many times I’ve planned it and written my suicide note."	offmychest	2022-07-01T16:08:32.000Z	Away_Ad5084
Everyday feels the same	com.example.redditnegative.model.RedditPost	7	20	"I wish I could go back to my teen years when I didn't care about no relationship or anything and all that mattered to me was my hobbies, now I can't do anything without this dreading thought and pressure that I'm getting older and still am a lonely virgin. 
I use to think that it's no big deal and that it will come naturally at some point, how naive I was."	ForeverAlone	2022-07-01T16:10:40.000Z	IndividualInstance57
Holidays are my worst favorite times just because everyone gets together with their friends when I have none	com.example.redditnegative.model.RedditPost	1	0	I can’t stand living like this anymore. I’m such a loser.	depression	2022-07-01T17:10:24.000Z	throawawayloser
Been desperate for help.	com.example.redditnegative.model.RedditPost	0	2	My life has been so filled nothing feeling empty and being lonely. No goals. No job. No one’s hiring me. Why am I here to struggle. Idk how I got so stuck and so beyond useless. I just want it to end. I’m really tempted to commit. It feels more real by the day. I’m tired. It feels inevitable.	depression	2022-07-01T16:44:48.000Z	Need-affection
Today I seriously thought about taking my life (but I won’t)	com.example.redditnegative.model.RedditPost	0	0	"I’ve been having a very hard time in just about every facet of my life. My relationship is a joke, my financial situation is not getting better, I don’t know where to go in life, I feel completely shut out of all my friends and families lives. I’m just tired of waking up to fight for I don’t even know what.

I thought about if I were dead my friends wouldn’t feel burdened by me. My boyfriend will probably be hurt for a little while, but he would move onto someone else soon after. My parents might be brought together do to my death. I don’t know I just feel like my death would be beneficial, like it might be sad for a little while, but then people will just say “at least he’s not suffering anymore,” and then proceed to move on and forget about me.

I feel worthless and it doesn’t help living in a country (U.S.) that agrees. I have all the wrong traits and genes to get by this life. I was not cut out for this world. I’m too kind, so people take advantage of me. I’m black so half the country hates me, and I’m gay so there’s another half of the country that hates me for that. Being both, in the eyes of them I’m a disgrace to world. It’s just tiring waking up knowing this is my reality on top of my personal demons.

If I speak out about some these issues I’m either pathetic, and just complaining, or in the words of some of my family “needing to man up.”

I came here because, really where else can I go? Therapy is expensive, and you have to shop around until you find one that “understands.”

I thought about really taking my life for all of these reasons, because I’m just human how much can one bare everyday until it might? get better.

I am currently not actively planning on doing anything to myself. These are just thoughts that are pushing suicidal boundaries.

TL;DR
I thought about ending my life because I feel worthless, and nothing is improving even though I’m doing everything in my power. However, I am not planning on taking action."	depression	2022-07-01T16:40:32.000Z	justemobro
Diagnosis	com.example.redditnegative.model.RedditPost	0	1	"So, its been a little while, I recently got a diagnosis for some stuff I have, and my first thought is ""yay I'm not crazy!"" though I also forgot to ask about bi-polar but for all I know is that I can now confidently (though I probably shouldn't be confident about it) have Depression and Anxiety, I'm only glad about it because I actually have it instead of just saying ""yeah I'm depressed"" or ""I have anxiety"" when I don't actually know if I have it or not, next time I see my psychiatrist ill ask them if I could test for bi-polar, oh and before I forget, apparently Ill also be getting medication sometime soon, they never actually told me what medication which was kinda dumb on my part but I mean, hopefully it'll help me not be as dumb, like focus since I also have had ADHD since like, I dunno 1st grade so cant wait to see what happens."	depression	2022-07-01T16:19:12.000Z	Affectionatemystery
I don't know what I'm thinking anymore.	com.example.redditnegative.model.RedditPost	11	4	"So I have recently been feeling completely lost and hopeless, I don't really know what I'm doing anymore. I'm 25yr old (Male). I feel like a failure, I have barely any money due to bills and low paying job - all my money goes on surviving this world we are in, I used to paint everyday and wanted/I guess still tell myself I do want to be an artist however I have no resources or time due to working all the time. The only emotion I feel is anger towards those who have so much security to chase their dreams and then I hate myself for hating people I don't even know anything about, I don't know their story. I feel like no matter how hard I try at something it's utterly pointless. I hate feeling sorry for myself yet I do it. I get frustrated all the time and then I'm not bothered by anything. I feel like I'm either constantly feeling everything on a hypersensitive channel and then...gone nothing at all, no feeling or reaction. I just don't know how to explain into words how I feel or what I experience. Like what's the point in being here if all I do is exist....I'm just here and in the grand scheme of things, not even here long. I don't understand all these people with motivational speeches about being the best and trying your hardest....it makes me feel shit, listening to it. I don't want to talk to anyone about anything and then I blurry everything out to someone i know I can trust and hate myself for it after because I think it was weak of me and they will think of me as weak. I really don't know what I'm saying here or how it's coming across and I'm just curious to see if anyone experiences this..... 

I just feel like giving up on everything."	depression	2022-07-01T16:17:04.000Z	Aztec_Flare
Is it normal/common to almost constantly think about killing yourself whenever you aren't feeling too great	com.example.redditnegative.model.RedditPost	1	4	"I know for a fact that I am never going to attempt something stupid and these are just thoughts but I can't seem to stop them. I want to know if other people have these ""what ifs..."" too or if I genuinely need help."	depression	2022-07-01T16:14:56.000Z	fifteenfountains
I hate the concept of family	com.example.redditnegative.model.RedditPost	1	1	I hate the idea of family. Nobody has ever caused me as much pain as fucking family. They are two faced, betraying, untrustworthy, gaslighting horrible people. I am sick of the idea of family. I wish I had zero family.	depression	2022-07-01T16:10:40.000Z	navyseals256
I’m Tired.	com.example.redditnegative.model.RedditPost	3	1	"I’ve had depression and suicidal thoughts since I was about 6 years old (yeah, it’s young I know but I had some horrible stuff happen to me so iykyk) because of my family, who’s way of coping with mental health/Illnesses is to just flat out ignore the issue, I’ve never had any treatment of any sort. The closest I came to anything like help was when I was about 15 years old and I told my father I was suicidal; resulting in my dad to allow me to take an antidepressant for all of maybe a month before calling me crazy and saying either I was a joke or the situation itself was. 

I’m 20 years old now, going on 21 in December, and I’m just so tired and so exhausted with life. I live with so much trauma that panic attacks and flashbacks of the trauma are a daily occurrence. I can’t get through my days anymore without drugging myself to the point that I’m nearly unconscious. I work a meaningless and pointless job as a waitress at a dying restaurant. I failed out of my college program and neither have the drive, the funds nor the mental security to return and finish it in the fall. My old hobbies, such are drawing, painting, crafting in general, fill me with nothing but boredom/nothingness. They honestly just feel like a chore. 

Basically, to sum it up, I have pretty bad depression and my life sucks. 

However, despite how bad things get, and how bad I know things are, I can never seem to bring myself to actually get help. I’ve reached out to people before, my sister, my dad, school councillors, friends, but it feels as if my efforts mean nothing. I try to call doctors to make an appointment but by the time I get through the normal 20-30 minute wait times they have I end up having panic attacks that render me unable to communicate at all (I mean I could scream and cry at them and hyperventilate for them but the most they’d get would be the rare word about me being unable to breathe) I go to therapy and the damn therapist says, and I quote, “don’t you think you are having a melodramatic reaction to it happening?” After being told about the times I was sexually, physically and mentally assaulted by my mother and her boyfriend. 

I’m just tired. I’m tired of this world that demands I move quickly through my trauma as if it didn’t happen and I’m tired of listening to the voices of people saying “it’ll get better” or “hang in there” cause frankly it’s not. 

I’m just so goddamn tired."	depression	2022-07-01T16:08:32.000Z	Anxious_Forevermore
Follow the leader: In the waning days of the Cold War, Rainer Sonntag helped fuel a neo-Nazi movement that still plagues Germany today. He was also a communist spy — and worked for Vladimir Putin	com.example.redditnegative.model.RedditPost	3	19	""	europe	2022-07-01T13:15:44.000Z	CrimsonLancet
Systematic Abuses at EU External Border: Greek Police Coerce Refugees to Commit Illegal Pushbacks	com.example.redditnegative.model.RedditPost	4	0	""	europe	2022-07-01T14:36:48.000Z	aknb
Egypt, Greece, Cyprus boost military cooperation in EastMed region	com.example.redditnegative.model.RedditPost	5	51	""	europe	2022-07-01T14:28:16.000Z	Mohamed-Saied92
Do you have this problem with electric scooters for rent in other countries as well as we do in Sweden?	com.example.redditnegative.model.RedditPost	396	1201	""	europe	2022-07-01T12:54:24.000Z	WhoAmIEven2
No more Scottish money should be given to Ukraine for weapons, say Nicola Sturgeon’s ministers	com.example.redditnegative.model.RedditPost	53	0	""	europe	2022-07-01T13:07:12.000Z	Zoomer_Boomer2003
Germany’s move to legalise cannabis expected to create ‘domino effect’	com.example.redditnegative.model.RedditPost	31	104	""	europe	2022-07-01T13:09:20.000Z	wolfcross_8ema50wma
I WANT TO GET THE FUCK OUT OF RUSSIA. But it's almost impossible without money, and the choice is fucking small, besides, the attitude to Russians is very fucked up, now I don't get a fucking thing?	com.example.redditnegative.model.RedditPost	29	36	""	europe	2022-07-01T13:41:20.000Z	Mr_Lio_Px
The European Arctic suffers through a heat wave	com.example.redditnegative.model.RedditPost	6	13	""	europe	2022-07-01T13:28:32.000Z	BalticsFox
Swedish Green Steel Firm Gets Permit to Build First Plant	com.example.redditnegative.model.RedditPost	1	6	""	europe	2022-07-01T12:28:48.000Z	Soupjoe5
Po Valley farmers living through Italy's worst drought for 70 years	com.example.redditnegative.model.RedditPost	12	18	""	europe	2022-07-01T11:22:40.000Z	Always__curious__
Experts present Latvian government list of 69 Soviet monuments to tear down	com.example.redditnegative.model.RedditPost	9	65	""	europe	2022-07-01T09:27:28.000Z	HumorSuspicious6183
"Little Big released the anti-war song ""GENERATION CANCELLATION"" and fleed Russia"	com.example.redditnegative.model.RedditPost	19	35	""	europe	2022-06-30T22:02:40.000Z	UpgradedSiera6666
To save NATO, destroy it	com.example.redditnegative.model.RedditPost	10	0	""	europe	2022-06-30T18:01:36.000Z	enkrstic
Trump's unknown threat - wanted to force Sweden to release ASAP Rocky	com.example.redditnegative.model.RedditPost	20	30	""	europe	2022-06-30T14:36:48.000Z	VeraciousViking
UK fails to tackle Russian 'dirty money' despite sanctions, MPs say	com.example.redditnegative.model.RedditPost	0	19	""	europe	2022-06-30T13:58:24.000Z	Quartz1992
Dead Space 2 Chapter 10 part 1 Ishimura Again. Fixing the centrifuge	com.example.redditnegative.model.RedditPost	1	0	" Dead Space 2 Chapter 10 part 1 Ishimura Again. Fixing the centrifuge

video link in comment

&amp;#x200B;

https://preview.redd.it/uvmf2tqbqz891.jpg?width=1347&amp;format=pjpg&amp;auto=webp&amp;s=ea33a7b7830d261398016e9bfe76556960e56a54"	gaming	2022-07-01T17:21:04.000Z	wolfsolus
What is a phrase or sound from a video games that is burned into your brain from repeatedly hearing it?	com.example.redditnegative.model.RedditPost	19	3	What is something that is forever stuck in you head from a video game?  Some of mine are, “Stay a while, and listen” - Deckard Cain, “Hey Listen” - Navi, diversion whistles from Sam Fisher in Splinter Cell Chaos Theory (I use this all the time with my wife as a call and response type thing), and “What’re ya  buyin/sellin” from Resident Evil 4, just to name a few.	gaming	2022-07-01T17:14:40.000Z	Tacticalsandwich7
My First (And Worst) Fallout Experience	com.example.redditnegative.model.RedditPost	1	1	""	gaming	2022-07-01T17:06:08.000Z	StyleNP
Need some help with Albion 1995.	com.example.redditnegative.model.RedditPost	1	1	"There is an old game on GoG, [Albion] (https://www.gog.com/en/game/albion) that I recently purchased.

There is also an updated patch on [GitHub] (https://github.com/M-HT/SR/releases).

I followed the instructions exactly step by by.

Installed game in c:\Games\Albion.
Copied the cd in the albioncd folder.
Set the setup file to read from the hdd.
And copied the patch file.

Still, it doesn't work on win10 x86 system. Is there anyone that got it working or knows how please? Any help would be appreciated, thanks."	gaming	2022-07-01T17:01:52.000Z	KleinWolf32
I stopped by a fast food place that still had Sonic game stations to play on	com.example.redditnegative.model.RedditPost	5	15	""	gaming	2022-07-01T16:59:44.000Z	___RustyShackleford_
Would you rather want a new Ghost of Tsushima game or a new infamous game?	com.example.redditnegative.model.RedditPost	8	3	""	gaming	2022-07-01T16:57:36.000Z	michaelmaier007
want advice helping some one use a controller	com.example.redditnegative.model.RedditPost	3	1	"I recently got it takes two cause I wanted to experience it first time with my wife, however she has no experience with playing games and quickly got frustrated by the platforming jumps at the beginning, she gave up for the night saying ""we just live different worlds, maybe some other time"" I don't want to just give up though. any suggestions on how I could help her out?"	gaming	2022-07-01T16:57:36.000Z	Wigglesworth47
Tons of NEW stuff in Devlog #2 of our game PREMORTAL VR	com.example.redditnegative.model.RedditPost	0	0	""	gaming	2022-07-01T16:10:40.000Z	gotiobg
My first encounter of a dangerous sea noodle, with a shot of adrenaline	com.example.redditnegative.model.RedditPost	5	10	""	gaming	2022-07-01T15:40:48.000Z	thedarkendkb
